{
  "$schema": "../../../schemas/upgrade-node.schema.json",
  "id": "upgrade:raider-bounty",
  "label": "Raider Bounty",
  "category": "economy",
  "cost": {
    "coins": 16
  },
  "ranks": 3,
  "rankCostGrowth": 1.7,
  "prerequisites": ["upgrade:unlock-oldwood-raider"],
  "enemyFamily": "oldwood-raider",
  "spawnBounty": 2,
  "unlocks": [],
  "track": "encounters",
  "note": "Each rank pays more coins per oldwood-raider felled — the income the enemy unlock promises, and the coin sink that keeps the antagonist chain wall-free."
}
